numero_cnj,numero_processo,relator,situacao,data_autuacao
0182864-75.2025.3.00.0000,1005395 / GO,Min. OG FERNANDES - SEXTA TURMA,22/05/2025 (08:51) CONCLUSOS PARA DECISÃO AO(À) MINISTRO(A) OG FERNANDES (RELATOR) - PELA SJD,21/05/2025
0182830-03.2025.3.00.0000,1005400 / GO,Min. JOEL ILAN PACIORNIK - QUINTA TURMA,22/05/2025 (08:51) CONCLUSOS PARA DECISÃO AO(À) MINISTRO(A) JOEL ILAN PACIORNIK (RELATOR) - PELA SJD,21/05/2025
0182823-11.2025.3.00.0000,1005399 / GO,Min. CARLOS CINI MARCHIONATTI (DESEMBARGADOR CONVOCADO TJRS) - QUINTA TURMA,22/05/2025 (15:03) CONCLUSOS PARA DECISÃO AO(À) MINISTRO(A) CARLOS CINI MARCHIONATTI (DESEMBARGADOR CONVOCADO TJRS) (RELATOR) - PELA SJD,21/05/2025
0182753-91.2025.3.00.0000,1005394 / GO,Min. JOEL ILAN PACIORNIK - QUINTA TURMA,22/05/2025 (08:51) CONCLUSOS PARA DECISÃO AO(À) MINISTRO(A) JOEL ILAN PACIORNIK (RELATOR) - PELA SJD,21/05/2025
0181750-04.2025.3.00.0000,1005272 / GO,Min. SEBASTIÃO REIS JÚNIOR - SEXTA TURMA,Aguardando andamento inicial,21/05/2025
0181405-38.2025.3.00.0000,1005172 / GO,Min. REYNALDO SOARES DA FONSECA - QUINTA TURMA,21/05/2025 (16:25) CONCLUSOS PARA DECISÃO AO(À) MINISTRO(A) REYNALDO SOARES DA FONSECA (RELATOR) - PELA SJD,21/05/2025
